product_name,price_elasticity,pricing_recommendation,total_revenue
HANGING MEDINA LANTERN SMALL,-24.111,Reduce Price (Highly Elastic),2457.9
CARD CHRISTMAS VILLAGE,-232.427,Reduce Price (Highly Elastic),2455.56
GARLAND WITH STARS AND BELLS,-86.062,Reduce Price (Highly Elastic),2449.3500000000004
PURPLE PAPER PARASOL,-112.433,Reduce Price (Highly Elastic),2440.3
SET OF 2 TINS JARDIN DE PROVENCE,-1.263,Reduce Price (Highly Elastic),2437.1
RIBBON REEL FLORA + FAUNA ,0.428,Increase Price (Inelastic),2433.32
HAND OPEN SHAPE DECO.WHITE,-32.735,Reduce Price (Highly Elastic),2426.2200000000003
"SPRING DEC , HANGING CHICK CREAM",-57.62,Reduce Price (Highly Elastic),2422.1
FLAMINGO LIGHTS,-5.374,Reduce Price (Highly Elastic),2416.85
GLASS ETCHED T-LIGHT HOLDER LARGE,-37.659,Reduce Price (Highly Elastic),2407.8
SET/4 PINK ORCHID CANDLES IN BOWL,-43.977,Reduce Price (Highly Elastic),2406.0299999999997
200 RED + WHITE BENDY STRAWS,-35.673,Reduce Price (Highly Elastic),2404.61
LIPSTICK PEN RED,-1.368,Reduce Price (Highly Elastic),2404.2
SET OF 3 WOODEN SLEIGH DECORATIONS,26.378,Increase Price (Inelastic),2400.45
BLUE DRAWER KNOB ACRYLIC EDWARDIAN,-49.529,Reduce Price (Highly Elastic),2400.4300000000003
DISCO BALL CHRISTMAS DECORATION,-163.191,Reduce Price (Highly Elastic),2399.8
GENTLEMAN SHIRT REPAIR KIT ,-1.747,Reduce Price (Highly Elastic),2399.13
MILK PAN PINK RETROSPOT,-19.821,Reduce Price (Highly Elastic),2396.9700000000003
LARGE WHITE HONEYCOMB PAPER BELL  ,-13.574,Reduce Price (Highly Elastic),2395.1
SHOE SHINE BOX ,-20.935,Reduce Price (Highly Elastic),2394.6499999999996
CLASSIC FRENCH STYLE BASKET GREEN ,-2.072,Reduce Price (Highly Elastic),2388.35
JIGSAW TREE WITH BIRDHOUSE,-0.02,Increase Price (Inelastic),2387.5699999999997
MINI JIGSAW CIRCUS PARADE ,-0.961,Optimize / Monitor Price,2387.46
BOMBS AWAY METAL SIGN,-17.206,Reduce Price (Highly Elastic),2387.34
"FEATHER PEN,COAL BLACK",-1.556,Reduce Price (Highly Elastic),2381.83
SWEETHEART WIRE WALL TIDY,-14.19,Reduce Price (Highly Elastic),2368.45
GARDENIA 1 WICK MORRIS BOXED CANDLE,-2.369,Reduce Price (Highly Elastic),2367.92
SET OF 2 ROUND TINS CAMEMBERT ,-1.198,Reduce Price (Highly Elastic),2363.63
T-LIGHT HOLDER SWEETHEART HANGING,-4.41,Reduce Price (Highly Elastic),2362.29
T-LIGHT HOLDER HANGING LACE,-1.991,Reduce Price (Highly Elastic),2356.02
POTTING SHED ROSE CANDLE,24.418,Increase Price (Inelastic),2355.78
SILK PURSE BABUSHKA RED,-130.27,Reduce Price (Highly Elastic),2355.4
DISCO BALL ROTATOR BATTERY OPERATED,-12.711,Reduce Price (Highly Elastic),2354.75
EASTER CRAFT IVY WREATH WITH CHICK,-194.275,Reduce Price (Highly Elastic),2350.65
APRON APPLE DELIGHT,-52.721,Reduce Price (Highly Elastic),2345.25
SPACEBOY CHILDRENS CUP,-5.604,Reduce Price (Highly Elastic),2344.32
"POPCORN HOLDER , SMALL ",-40.364,Reduce Price (Highly Elastic),2344.2999999999997
4 IVORY DINNER CANDLES SILVER FLOCK,-1.17,Reduce Price (Highly Elastic),2341.98
HAPPY EASTER HANGING DECORATION,-348.937,Reduce Price (Highly Elastic),2340.66
LARGE PURPLE BABUSHKA NOTEBOOK  ,-2.154,Reduce Price (Highly Elastic),2338.39
DAISIES  HONEYCOMB GARLAND ,-87.962,Reduce Price (Highly Elastic),2337.9
PAPER CHAIN KIT LONDON,-11.388,Reduce Price (Highly Elastic),2337.2400000000002
MEDINA STAMPED METAL STOOL,-11.018,Reduce Price (Highly Elastic),2336.9
WOOD STOCKING CHRISTMAS SCANDISPOT,-0.557,Optimize / Monitor Price,2336.68
MISTLETOE HEART WREATH CREAM,34.328,Increase Price (Inelastic),2336.28
IVORY PILLAR CANDLE SILVER FLOCK,-2.102,Reduce Price (Highly Elastic),2331.34
SET OF 6 T-LIGHTS CACTI ,0.151,Increase Price (Inelastic),2328.63
EUCALYPTUS & PINECONE  WREATH,-3.556,Reduce Price (Highly Elastic),2327.2000000000003
ANGEL DECORATION STARS ON DRESS,-271.577,Reduce Price (Highly Elastic),2325.96
PINK DINER WALL CLOCK,-52.572,Reduce Price (Highly Elastic),2325.6
3D CHRISTMAS STAMPS STICKERS ,0.158,Increase Price (Inelastic),2316.4300000000003
PACK OF 20 SPACEBOY NAPKINS,-21.463,Reduce Price (Highly Elastic),2313.5299999999997
TEA TIME MUG IN GIFT BOX,-184.261,Reduce Price (Highly Elastic),2312.7000000000003
PINK FELT EASTER EGG BASKET,-282.55,Reduce Price (Highly Elastic),2311.55
MEASURING TAPE BABUSHKA PINK,-31.597,Reduce Price (Highly Elastic),2311.55
SET OF 6 CAKE CHOPSTICKS,-2.988,Reduce Price (Highly Elastic),2309.56
BLUE/CREAM STRIPE FRINGE HAMMOCK,-103.462,Reduce Price (Highly Elastic),2307.8
BAKING MOULD EASTER EGG MILK CHOC,-192.065,Reduce Price (Highly Elastic),2307.6000000000004
SILVER MUG BONE CHINA TREE OF LIFE,-1.375,Reduce Price (Highly Elastic),2307.29
SMALL SILVER TRELLIS CANDLEPOT,1446773166277684.0,Increase Price (Inelastic),2306.9
"NURSERY A,B,C PAINTED LETTERS",-1.704,Reduce Price (Highly Elastic),2304.4
CHARLIE+LOLA RED HOT WATER BOTTLE ,-2.419,Reduce Price (Highly Elastic),2303.62
PINK ROSE WASHBAG,-40.947,Reduce Price (Highly Elastic),2302.5
SET OF 4 NEW ENGLAND PLACEMATS,-43.386,Reduce Price (Highly Elastic),2298.0
CHOCOLATE 3 WICK MORRIS BOX CANDLE,-1.886,Reduce Price (Highly Elastic),2293.12
SMALL SKULL WINDMILL,-70.302,Reduce Price (Highly Elastic),2290.28
GREEN GINGHAM FLOWER JEWELLERY BOX,-331.387,Reduce Price (Highly Elastic),2290.0499999999997
4 PEAR BOTANICAL DINNER CANDLES,-3.279,Reduce Price (Highly Elastic),2286.25
CARD I LOVE LONDON ,-7.281,Reduce Price (Highly Elastic),2284.84
SQUARE CHERRY BLOSSOM CABINET,-1.396,Reduce Price (Highly Elastic),2281.2000000000003
S/16 VINTAGE BLACK CUTLERY,-56.793,Reduce Price (Highly Elastic),2278.0499999999997
ASSORTED TUTTI FRUTTI PEN,-1.113,Reduce Price (Highly Elastic),2277.0899999999997
IF YOU CAN'T STAND THE HEAT MUG,-3.649,Reduce Price (Highly Elastic),2276.75
3 WHITE CHOC MORRIS BOXED CANDLES,-2.683,Reduce Price (Highly Elastic),2271.73
SMALL HANGING IVORY/RED WOOD BIRD,7.442,Increase Price (Inelastic),2269.61
KIDS RAIN MAC PINK,-19.374,Reduce Price (Highly Elastic),2269.48
SET OF 12  VINTAGE POSTCARD SET,-1.853,Reduce Price (Highly Elastic),2267.47
SET OF 10 LANTERNS FAIRY LIGHT STAR,70.334,Increase Price (Inelastic),2264.7400000000002
SET OF 36 MUSHROOM PAPER DOILIES,-59.582,Reduce Price (Highly Elastic),2262.6
MAKE YOUR OWN PLAYTIME CARD KIT,-1.852,Reduce Price (Highly Elastic),2260.6800000000003
MAGIC DRAWING SLATE DINOSAUR,-34.019,Reduce Price (Highly Elastic),2260.26
SET OF 4 NAPKIN CHARMS STARS   ,-0.476,Optimize / Monitor Price,2258.75
MEASURING TAPE BABUSHKA RED,-163.766,Reduce Price (Highly Elastic),2254.75
OCEAN STRIPE HAMMOCK ,-85.489,Reduce Price (Highly Elastic),2253.3
AIRLINE BAG VINTAGE JET SET BROWN,-1.075,Reduce Price (Highly Elastic),2251.95
SET OF 6 3D KIT CARDS FOR KIDS,0.987,Increase Price (Inelastic),2251.18
3 ROSE MORRIS BOXED CANDLES,-3.78,Reduce Price (Highly Elastic),2249.98
GLITTER CHRISTMAS STAR ,-2.279,Reduce Price (Highly Elastic),2248.88
VINTAGE LEAF MAGNETIC NOTEPAD,-166.002,Reduce Price (Highly Elastic),2246.9999999999995
WOODLAND  STICKERS,-91.554,Reduce Price (Highly Elastic),2245.62
PAINTED METAL HEART WITH HOLLY BELL,-0.592,Optimize / Monitor Price,2244.93
BUTTERFLIES  HONEYCOMB GARLAND,-83.477,Reduce Price (Highly Elastic),2243.55
GREEN ROSE WASHBAG,-49.25,Reduce Price (Highly Elastic),2242.5
OVEN MITT APPLES DESIGN,-1.392,Reduce Price (Highly Elastic),2236.36
PENS ASSORTED SPACEBALL,-1.16,Reduce Price (Highly Elastic),2234.78
RIBBON REEL SOCKS AND MITTENS,-4.847,Reduce Price (Highly Elastic),2233.83
CHRISTMAS HANGING TREE WITH BELL,-1.428,Reduce Price (Highly Elastic),2231.83
3 TIER SWEETHEART GARDEN SHELF,-20.779,Reduce Price (Highly Elastic),2225.8500000000004
4 LAVENDER BOTANICAL DINNER CANDLES,-2.921,Reduce Price (Highly Elastic),2223.25
RED REFECTORY CLOCK ,-70.961,Reduce Price (Highly Elastic),2222.2
SNOWFLAKE PORTABLE TABLE LIGHT ,13.488,Increase Price (Inelastic),2219.59
FELTCRAFT HAIRBAND PINK AND PURPLE,-1.952,Reduce Price (Highly Elastic),2218.5499999999997
HANGING MEDINA LANTERN LARGE,-6.426,Reduce Price (Highly Elastic),2218.25
ASSORTED INCENSE PACK,-10.452,Reduce Price (Highly Elastic),2213.97
VANILLA INCENSE IN TIN,-1.034,Reduce Price (Highly Elastic),2213.32
SWEETHEART CARRY-ALL BASKET,-202.926,Reduce Price (Highly Elastic),2211.7
EASTER TREE YELLOW BIRDS,-183.523,Reduce Price (Highly Elastic),2210.1
RECYCLED ACAPULCO MAT LAVENDER,-330.267,Reduce Price (Highly Elastic),2206.2
AIRLINE BAG VINTAGE JET SET WHITE,0.101,Increase Price (Inelastic),2201.19
SUNSET CHECK HAMMOCK,-29.218,Reduce Price (Highly Elastic),2199.4500000000003
TOADSTOOL BEDSIDE LIGHT ,-56.237,Reduce Price (Highly Elastic),2198.6
CHARLIE & LOLA WASTEPAPER BIN BLUE,-1.251,Reduce Price (Highly Elastic),2194.75
BAKING MOULD ROSE MILK CHOCOLATE,-3.498,Reduce Price (Highly Elastic),2191.5
CUT GLASS T-LIGHT HOLDER OCTAGON,-4.748,Reduce Price (Highly Elastic),2189.61
CARD BILLBOARD FONT,-0.842,Optimize / Monitor Price,2189.43
WRAP CIRCUS PARADE,-51.579,Reduce Price (Highly Elastic),2189.34
3 GARDENIA MORRIS BOXED CANDLES,-3.456,Reduce Price (Highly Elastic),2187.11
GIANT MEDINA STAMPED METAL BOWL ,-66.536,Reduce Price (Highly Elastic),2184.1
MINI JIGSAW DOLLY GIRL,-0.861,Optimize / Monitor Price,2182.49
ANTIQUE ALL GLASS CANDLESTICK,-11.161,Reduce Price (Highly Elastic),2180.88
HANGING GLASS ETCHED TEALIGHT,-82.05,Reduce Price (Highly Elastic),2180.7000000000003
FRYING PAN PINK POLKADOT,-0.682,Optimize / Monitor Price,2175.04
SET OF 3 WOODEN TREE DECORATIONS,31.982,Increase Price (Inelastic),2172.46
WATERMELON BATH SPONGE,-105.934,Reduce Price (Highly Elastic),2169.95
WHITE BROCANTE SOAP DISH,-91.325,Reduce Price (Highly Elastic),2169.65
SET OF 6 GIRLS CELEBRATION CANDLES,-10.491,Reduce Price (Highly Elastic),2169.18
BLUE/BROWN DOTS RUFFLED UMBRELLA,-79.636,Reduce Price (Highly Elastic),2167.85
CHRISTMAS HANGING HEART WITH BELL,-450.698,Reduce Price (Highly Elastic),2167.64
GARDENIA 3 WICK MORRIS BOXED CANDLE,-3.248,Reduce Price (Highly Elastic),2167.42
EMPIRE TISSUE BOX,-1.416,Reduce Price (Highly Elastic),2167.18
CHILDRENS GARDEN GLOVES PINK,-34.663,Reduce Price (Highly Elastic),2165.85
CHILDRENS GARDEN GLOVES BLUE,-36.171,Reduce Price (Highly Elastic),2159.16
MONEY BOX BISCUITS DESIGN,45.652,Increase Price (Inelastic),2152.8999999999996
WRAP DOLLY GIRL,-54.321,Reduce Price (Highly Elastic),2151.0
LARGE HANGING IVORY & RED WOOD BIRD,-54.123,Reduce Price (Highly Elastic),2150.08
BLUE FELT EASTER EGG BASKET,-305.483,Reduce Price (Highly Elastic),2149.35
BUTTERFLY CROCHET FOOD COVER,-5.828,Reduce Price (Highly Elastic),2147.92
MOBILE VINTAGE HEARTS ,-23.032,Reduce Price (Highly Elastic),2147.25
SET 6 FOOTBALL CELEBRATION CANDLES,-12.376,Reduce Price (Highly Elastic),2144.02
WRAP VINTAGE LEAF DESIGN,-65.966,Reduce Price (Highly Elastic),2140.92
WOODLAND ANIMAL  WRITING SET ,-140.761,Reduce Price (Highly Elastic),2139.65
VINTAGE RED ENAMEL TRIM JUG ,-178.579,Reduce Price (Highly Elastic),2138.34
CHILDREN'S CIRCUS PARADE MUG,0.349,Increase Price (Inelastic),2129.08
GREEN CHRISTMAS TREE STRING 20LIGHT,-26.45,Reduce Price (Highly Elastic),2127.3
DANISH ROSE PHOTO FRAME,-1.825,Reduce Price (Highly Elastic),2125.9500000000003
SMALL PARISIENNE HEART PHOTO FRAME ,-17.473,Reduce Price (Highly Elastic),2125.1600000000003
SET OF 12 LILY BOTANICAL T-LIGHTS,-50.548,Reduce Price (Highly Elastic),2122.4500000000003
UNION JACK FLAG LUGGAGE TAG,-3.589,Reduce Price (Highly Elastic),2114.65
CARD CIRCUS PARADE,-6.557,Reduce Price (Highly Elastic),2111.79
WRAP POPPIES  DESIGN,-71.142,Reduce Price (Highly Elastic),2105.5
RAINY LADIES BIRTHDAY CARD,-6.546,Reduce Price (Highly Elastic),2104.81
BAKING MOULD TOFFEE CUP CHOCOLATE,-82.054,Reduce Price (Highly Elastic),2104.65
FRENCH ENAMEL POT W LID,-3.057,Reduce Price (Highly Elastic),2101.61
WHITE CHRISTMAS GARLAND STARS TREES,-70.794,Reduce Price (Highly Elastic),2100.45
WHITE BELL HONEYCOMB PAPER GARLAND ,-50.117,Reduce Price (Highly Elastic),2098.65
GREEN  SPOTTY PLATE ,-36.922,Reduce Price (Highly Elastic),2093.0099999999998
PAPER LANTERN 9 POINT DELUXE STAR,-189.54,Reduce Price (Highly Elastic),2091.55
EIGHT PIECE DINOSAUR SET,-27.288,Reduce Price (Highly Elastic),2090.21
LARGE CAKE TOWEL CHOCOLATE SPOTS,-2.845,Reduce Price (Highly Elastic),2084.1
PORCELAIN ROSE LARGE ,-40.953,Reduce Price (Highly Elastic),2079.3
TV DINNER TRAY AIR HOSTESS ,-2.666,Reduce Price (Highly Elastic),2076.73
HOME GARLAND PAINTED ZINC ,-0.664,Optimize / Monitor Price,2070.45
BAKING MOULD HEART WHITE CHOCOLATE,-7.66,Reduce Price (Highly Elastic),2068.06
CAKE PLATE LOVEBIRD PINK,-3.776,Reduce Price (Highly Elastic),2065.2
"CHRISTMAS GARLAND STARS,TREES",1.105,Increase Price (Inelastic),2065.0
STRIPEY CHOCOLATE NESTING BOXES,-7.849,Reduce Price (Highly Elastic),2063.4
DRAWER KNOB CRACKLE GLAZE GREEN,-73.109,Reduce Price (Highly Elastic),2060.4
CAT BOWL ,-3.259,Reduce Price (Highly Elastic),2057.7
JAPANESE CROCHETED ANIMAL,-23.35,Reduce Price (Highly Elastic),2056.38
"FEATHER PEN,LIGHT PINK",-1.433,Reduce Price (Highly Elastic),2055.36
RED SPOTTY PURSE ,-10.903,Reduce Price (Highly Elastic),2054.8500000000004
PINK FAIRY CAKE CUSHION COVER,-3.718,Reduce Price (Highly Elastic),2054.1
HERB MARKER BASIL,-422.927,Reduce Price (Highly Elastic),2053.65
SLEEPING CAT ERASERS,-7.473,Reduce Price (Highly Elastic),2051.34
DOVE DECORATION PAINTED ZINC ,-2.934,Reduce Price (Highly Elastic),2048.29
MAGNETS PACK OF 4 HOME SWEET HOME,-1.396,Reduce Price (Highly Elastic),2047.54
SPOTTY PINK DUCK DOORSTOP,-3.6,Reduce Price (Highly Elastic),2042.49
PACK 20 DOLLY PEGS,0.35,Increase Price (Inelastic),2042.35
RETRO SPOT SUGAR JAM BOWL,-201.177,Reduce Price (Highly Elastic),2039.8500000000001
EMBOSSED HEART 3 DRAWER SHELF,2.249,Increase Price (Inelastic),2038.35
4 LILY  BOTANICAL DINNER CANDLES,-2.277,Reduce Price (Highly Elastic),2037.5
GLASS JAR MARMALADE ,-9.976,Reduce Price (Highly Elastic),2037.2400000000002
HANGING RIDGE GLASS T-LIGHT HOLDER,-41.89,Reduce Price (Highly Elastic),2034.8400000000001
EAU DE NIL DINER WALL CLOCK,-269.462,Reduce Price (Highly Elastic),2033.2
CARD BIRTHDAY COWBOY,2.796,Increase Price (Inelastic),2032.05
FOLDING UMBRELLA  CHOC/WHITE  SPOT,-9.128,Reduce Price (Highly Elastic),2023.8
60 GOLD AND SILVER FAIRY CAKE CASES,-26.874,Reduce Price (Highly Elastic),2021.6299999999999
"SPRING DEC , HANGING CHICK  YELLOW",-94.8,Reduce Price (Highly Elastic),2018.6
BATH DUCK WATERING CAN,-63.878,Reduce Price (Highly Elastic),2016.52
IVORY SWEETHEART WIRE LETTER RACK ,-57.683,Reduce Price (Highly Elastic),2013.51
CREAM SLICE FLANNEL CHOCOLATE SPOT ,-20.388,Reduce Price (Highly Elastic),2011.8000000000002
PARTY CONES CANDY TREE DECORATION,-8.672,Reduce Price (Highly Elastic),2008.76
CHILDS GARDEN SPADE BLUE,-111.649,Reduce Price (Highly Elastic),2003.88
RED SPOTTY BIG BOWL,-15.661,Reduce Price (Highly Elastic),2002.8000000000002
CHERRY DESIGN PAPERLANTERNS,-1.259,Reduce Price (Highly Elastic),2002.3899999999999
SET/3 FLORAL GARDEN TOOLS IN BAG,-15.281,Reduce Price (Highly Elastic),2001.95
DRAWER KNOB CRACKLE GLAZE PINK,-95.278,Reduce Price (Highly Elastic),1997.7
BLACK ENCHANTED FOREST PLACEMAT,-78.564,Reduce Price (Highly Elastic),1997.25
MORE BUTTER METAL SIGN ,-1.511,Reduce Price (Highly Elastic),1996.75
EMPIRE BIRTHDAY CARD,-6.473,Reduce Price (Highly Elastic),1994.9099999999999
KNEELING MAT HOUSEWORK  DESIGN,-1.656,Reduce Price (Highly Elastic),1993.91
SET/20 WOODLAND PAPER NAPKINS ,-80.581,Reduce Price (Highly Elastic),1993.08
SKULLS GREETING CARD,-11.06,Reduce Price (Highly Elastic),1988.04
SET OF 2 CERAMIC CHRISTMAS REINDEER,3.65,Increase Price (Inelastic),1981.63
GREEN POLKADOT BOWL,-9.953,Reduce Price (Highly Elastic),1975.31
GLASS  SONGBIRD STORAGE JAR,-45.417,Reduce Price (Highly Elastic),1965.3
RED COAT RACK PARIS FASHION,-54.15,Reduce Price (Highly Elastic),1963.8899999999999
ICE CREAM DESIGN GARDEN PARASOL,-9.912,Reduce Price (Highly Elastic),1963.3500000000001
GLASS JAR PEACOCK BATH SALTS,-5.832,Reduce Price (Highly Elastic),1955.93
BLUE PADDED SOFT MOBILE,-50.489,Reduce Price (Highly Elastic),1955.25
STORAGE TIN VINTAGE LEAF,-0.507,Optimize / Monitor Price,1955.1299999999999
FILIGREE HEART BUTTERFLY WHITE ,2.385,Increase Price (Inelastic),1947.06
PAINTED METAL STAR WITH HOLLY BELLS,-1.488,Reduce Price (Highly Elastic),1946.1
RELAX LARGE WOOD LETTERS,-1.757,Reduce Price (Highly Elastic),1945.8
LOCAL CAFE MUG,-2.632,Reduce Price (Highly Elastic),1944.3300000000002
FRYING PAN RED RETROSPOT,-1.177,Reduce Price (Highly Elastic),1942.75
VINTAGE RED ENAMEL TRIM MUG ,17.641,Increase Price (Inelastic),1941.7
BIRDHOUSE DECORATION MAGIC GARDEN,-25.422,Reduce Price (Highly Elastic),1926.69
ENGLISH ROSE NOTEBOOK A7 SIZE,-2.277,Reduce Price (Highly Elastic),1923.58
PINK DIAMANTE PEN IN GIFT BOX,-5.088,Reduce Price (Highly Elastic),1923.22
STAR WREATH DECORATION WITH BELL,30.216,Increase Price (Inelastic),1923.19
CHILDS GARDEN SPADE PINK,-114.97,Reduce Price (Highly Elastic),1923.18
SKETCHBOOK MAGNETIC SHOPPING LIST,5.939,Increase Price (Inelastic),1921.24
EASTER TIN BUNNY BOUQUET,-47.398,Reduce Price (Highly Elastic),1918.5
WRAP DOILEY DESIGN,-81.302,Reduce Price (Highly Elastic),1915.5
SET 12 WILDFLOWER BOTANICAL T-LIGHT,-32.214,Reduce Price (Highly Elastic),1912.6000000000001
COSY SLIPPER SHOES LARGE GREEN,-94.586,Reduce Price (Highly Elastic),1910.1000000000001
HANGING HEART WITH BELL,-3.823,Reduce Price (Highly Elastic),1907.83
ZINC FINISH 15CM PLANTER POTS,-44.751,Reduce Price (Highly Elastic),1907.53
12 PENCILS TALL TUBE POSY,-3.347,Reduce Price (Highly Elastic),1906.1699999999998
YELLOW METAL CHICKEN HEART ,-33.325,Reduce Price (Highly Elastic),1903.05
MUSHROOM BLUE HOT WATER BOTTLE,-5.909,Reduce Price (Highly Elastic),1901.5500000000002
PINK SPOTS CHOCOLATE NESTING BOXES ,-10.601,Reduce Price (Highly Elastic),1900.0500000000002
ELEPHANT CARNIVAL POUFFE,-11.521,Reduce Price (Highly Elastic),1897.6999999999998
REGENCY CAKE FORK,-29.292,Reduce Price (Highly Elastic),1896.6
ZINC T-LIGHT HOLDER STAR LARGE,-3.784,Reduce Price (Highly Elastic),1896.54
IVORY REFECTORY CLOCK,-31.924,Reduce Price (Highly Elastic),1894.6999999999998
SILVER LATTICE VANILLA CANDLE POT,18.305,Increase Price (Inelastic),1893.78
WRAP 50'S  CHRISTMAS,-414.481,Reduce Price (Highly Elastic),1892.46
MONEY BOX POCKET MONEY DESIGN,-0.922,Optimize / Monitor Price,1891.55
HAND OPEN SHAPE GOLD,-2.274,Reduce Price (Highly Elastic),1886.55
LARGE CHINESE STYLE SCISSOR,-7.048,Reduce Price (Highly Elastic),1885.15
SEWING SUSAN 21 NEEDLE SET,-0.525,Optimize / Monitor Price,1883.9999999999998
DAIRY MAID  PUDDING BOWL,-20.947,Reduce Price (Highly Elastic),1882.5
DOLLY GIRL CHILDRENS CUP,0.358,Increase Price (Inelastic),1881.39
"AIRLINE LOUNGE,METAL SIGN",-6.995,Reduce Price (Highly Elastic),1880.8100000000002
TRAVEL CARD WALLET VINTAGE TICKET,-37.939,Reduce Price (Highly Elastic),1880.16
12 PENCILS TALL TUBE RED SPOTTY,-135.95,Reduce Price (Highly Elastic),1879.8899999999999
STEEL SWEETHEART ROUND TABLE CREAM,-77.715,Reduce Price (Highly Elastic),1878.9499999999998
DOG BOWL VINTAGE CREAM,-24.937,Reduce Price (Highly Elastic),1878.42
WICKER WREATH SMALL,-2.995,Reduce Price (Highly Elastic),1875.6699999999998
STAR T-LIGHT HOLDER WILLIE WINKIE,2.162,Increase Price (Inelastic),1875.06
GREEN POLKADOT PLATE ,-8.262,Reduce Price (Highly Elastic),1874.9099999999999
WOOD AND GLASS MEDICINE CABINET,-24.29,Reduce Price (Highly Elastic),1874.65
IVORY PILLAR CANDLE GOLD FLOCK,-9.49,Reduce Price (Highly Elastic),1873.5
BOX OF 6 ASSORTED COLOUR TEASPOONS,2.677,Increase Price (Inelastic),1871.49
SWEETHEART WIRE FRUIT BOWL,-0.884,Optimize / Monitor Price,1870.1000000000001
CUT GLASS HEXAGON T-LIGHT HOLDER,-5.552,Reduce Price (Highly Elastic),1869.3999999999999
CALENDAR FAMILY FAVOURITES,1.676,Increase Price (Inelastic),1868.83
ALUMINIUM STAMPED HEART,-22.176,Reduce Price (Highly Elastic),1862.5100000000002
VINTAGE BILLBOARD MUG ,-3.471,Reduce Price (Highly Elastic),1859.91
CHILDS GARDEN TROWEL PINK,-112.972,Reduce Price (Highly Elastic),1857.37
DOLLY GIRL CHILDRENS BOWL,-109.12,Reduce Price (Highly Elastic),1854.8500000000001
SILK PURSE RUSSIAN DOLL RED,-234.868,Reduce Price (Highly Elastic),1854.2500000000002
DOLLY MIXTURE CHILDREN'S UMBRELLA,3.03,Increase Price (Inelastic),1850.13
PINK LOVE HEART SHAPE CUP,-4.318,Reduce Price (Highly Elastic),1848.84
4 VANILLA BOTANICAL CANDLES,-2.727,Reduce Price (Highly Elastic),1848.75
PARTY INVITES WOODLAND,-3.906,Reduce Price (Highly Elastic),1845.57
SET/6 WOODLAND PAPER CUPS,-74.489,Reduce Price (Highly Elastic),1843.77
ABSTRACT CIRCLE JOURNAL ,-9.72,Reduce Price (Highly Elastic),1841.4
CHILDS GARDEN TROWEL BLUE ,-77.161,Reduce Price (Highly Elastic),1840.9399999999998
PARLOUR CERAMIC WALL HOOK,-27.773,Reduce Price (Highly Elastic),1840.0
SCENTED VELVET LOUNGE CANDLE ,-0.963,Optimize / Monitor Price,1833.57
MEASURING TAPE BABUSHKA BLUE,-62.279,Reduce Price (Highly Elastic),1831.65
SMALL DECO JEWELLERY STAND,-151.393,Reduce Price (Highly Elastic),1831.65
GREEN SPOTTY BOWL,-34.185,Reduce Price (Highly Elastic),1831.53
IVORY HANGING DECORATION  BIRD,-342.121,Reduce Price (Highly Elastic),1829.4799999999998
BROCANTE SHELF WITH HOOKS,-56.059,Reduce Price (Highly Elastic),1827.4
CHILDS GARDEN FORK BLUE ,-119.57,Reduce Price (Highly Elastic),1821.08
PACK OF 12 BLUE PAISLEY TISSUES ,-1.032,Reduce Price (Highly Elastic),1819.7599999999998
S/12 VANILLA  BOTANICAL T-LIGHTS,-27.403,Reduce Price (Highly Elastic),1814.4000000000003
SET OF 6 FUNKY BEAKERS,-3.743,Reduce Price (Highly Elastic),1808.5400000000002
HANGING CHICK CREAM DECORATION,-5785444077724109.0,Reduce Price (Highly Elastic),1806.7
SET OF 2 ROUND TINS DUTCH CHEESE,-1.46,Reduce Price (Highly Elastic),1805.2900000000002
SMALL TAHITI BEACH BAG,-34.758,Reduce Price (Highly Elastic),1802.49
BABY MOUSE RED GINGHAM DRESS,-116.811,Reduce Price (Highly Elastic),1802.25
STAR DECORATION PAINTED ZINC ,-2.985,Reduce Price (Highly Elastic),1797.81
METAL DECORATION NAUGHTY CHILDREN ,-0.475,Optimize / Monitor Price,1793.1599999999999
JUNGLE POPSICLES ICE LOLLY HOLDERS,-89.242,Reduce Price (Highly Elastic),1793.15
PINK JUMPER LARRY THE LAMB,-57.357,Reduce Price (Highly Elastic),1792.92
BLUE FAIRY CAKE CHILD'S APRON,-76.167,Reduce Price (Highly Elastic),1792.6499999999999
CHILDS GARDEN FORK PINK,-131.273,Reduce Price (Highly Elastic),1791.07
TRAVEL CARD WALLET I LOVE LONDON,-260.772,Reduce Price (Highly Elastic),1788.72
STRAWBERRY DREAM CHILDS UMBRELLA,-140.659,Reduce Price (Highly Elastic),1787.5
SWISS ROLL TOWEL PINK  SPOTS,1.283,Increase Price (Inelastic),1782.18
BLUE POT PLANT CANDLE ,-1.252,Reduce Price (Highly Elastic),1776.2500000000002
HYACINTH BULB T-LIGHT CANDLES,-73.299,Reduce Price (Highly Elastic),1775.8799999999999
WHITE RETRODISC LAMPSHADE,0.228,Increase Price (Inelastic),1775.1
SET/20 FRUIT SALAD PAPER NAPKINS ,-19.923,Reduce Price (Highly Elastic),1767.6999999999998
MAGIC DRAWING SLATE BAKE A CAKE ,-15.827,Reduce Price (Highly Elastic),1763.16
DAIRY MAID BUTTER DISH,-39.726,Reduce Price (Highly Elastic),1762.5
DRAWER KNOB CRACKLE GLAZE BLUE,52.488,Increase Price (Inelastic),1761.69
HANGING HEART MIRROR DECORATION ,-5.269,Reduce Price (Highly Elastic),1760.45
12 PINK ROSE PEG PLACE SETTINGS,-78.182,Reduce Price (Highly Elastic),1758.58
ASSORTED CAKES FRIDGE MAGNETS,-72.553,Reduce Price (Highly Elastic),1756.08
ASSORTED ICE CREAM FRIDGE MAGNETS,-55.599,Reduce Price (Highly Elastic),1755.8100000000002
WOOD STAMP SET BEST WISHES,-1.941,Reduce Price (Highly Elastic),1755.42
MEASURING TAPE RUSSIAN DOLL RED,-231.058,Reduce Price (Highly Elastic),1755.0500000000002
SET OF 6 HEART CHOPSTICKS,-2.666,Reduce Price (Highly Elastic),1749.42
SMALL SILVER FLOWER CANDLE POT,-1.409,Reduce Price (Highly Elastic),1748.6000000000001
ABSTRACT CIRCLES SKETCHBOOK ,-5.75,Reduce Price (Highly Elastic),1748.13
CHARLIE LOLA BLUE HOT WATER BOTTLE ,-1.79,Reduce Price (Highly Elastic),1747.9399999999998
GOLD MUG BONE CHINA TREE OF LIFE,-1.313,Reduce Price (Highly Elastic),1746.61
FRENCH STYLE WALL DRESSER,-2.817,Reduce Price (Highly Elastic),1740.0
WOODLAND STORAGE BOX LARGE ,-8.385,Reduce Price (Highly Elastic),1739.5400000000002
FELTCRAFT BOY JEAN-PAUL KIT,4.708,Increase Price (Inelastic),1735.98
BOUDOIR SQUARE TISSUE BOX,-2.023,Reduce Price (Highly Elastic),1735.72
EASTER TIN KEEPSAKE,-41.663,Reduce Price (Highly Elastic),1732.05
CAT BOWL VINTAGE CREAM,-56.324,Reduce Price (Highly Elastic),1729.45
GARDEN PATH JOURNAL,-5.91,Reduce Price (Highly Elastic),1729.21
FILIGREE HEART BIRD WHITE ,-2.452,Reduce Price (Highly Elastic),1726.3
ASSORTED TUTTI FRUTTI  FOB NOTEBOOK,-72.102,Reduce Price (Highly Elastic),1724.92
MULTICOLOUR HONEYCOMB PAPER GARLAND,-4.812,Reduce Price (Highly Elastic),1724.3500000000001
VINTAGE GLASS T-LIGHT HOLDER,12.83,Increase Price (Inelastic),1723.6200000000001
SET/6 FRUIT SALAD PAPER CUPS,-1.167,Reduce Price (Highly Elastic),1723.3300000000002
6 RIBBONS SHIMMERING PINKS ,-2.502,Reduce Price (Highly Elastic),1722.44
OPULENT VELVET SET/3 CANDLES,3.488,Increase Price (Inelastic),1719.6
BALLOON ART MAKE YOUR OWN FLOWERS,-1.927,Reduce Price (Highly Elastic),1718.94
PACK OF 12 SPACEBOY TISSUES,-0.701,Optimize / Monitor Price,1717.2499999999998
MINIATURE ANTIQUE ROSE HOOK IVORY,62.234,Increase Price (Inelastic),1715.7
HEARTS  STICKERS,1.039,Increase Price (Inelastic),1714.3799999999999
VINTAGE KITCHEN PRINT VEGETABLES,-9.928,Reduce Price (Highly Elastic),1714.2
FOLKART STAR CHRISTMAS DECORATIONS,-2.74,Reduce Price (Highly Elastic),1712.4099999999999
WRAP COWBOYS  ,-53.961,Reduce Price (Highly Elastic),1711.3
PARTY FOOD SHOPPER BAG,-24.119,Reduce Price (Highly Elastic),1710.8
RED SPOTTY SHOPPING BAG,26.958,Increase Price (Inelastic),1708.35
DOORSTOP FOOTBALL DESIGN,-1.267,Reduce Price (Highly Elastic),1702.21
SMALL YELLOW BABUSHKA NOTEBOOK ,-0.998,Optimize / Monitor Price,1696.9399999999998
"DECORATION, HANGING HEART+MIRROR ",7.011,Increase Price (Inelastic),1695.15
GEORGIAN TRINKET BOX,-32.099,Reduce Price (Highly Elastic),1694.0
FELTCRAFT HAIRBAND PINK AND BLUE,-71.66,Reduce Price (Highly Elastic),1688.9299999999998
